{
  "schemaVersion": 1,
  "reviewId": "example-review",
  "scope": "behavioral",
  "reviewer": {
    "target": "openrouter/moonshotai/kimi-k2.7-code",
    "family": "kimi-k2.7-code"
  },
  "findings": [
    {
      "id": "F-001",
      "severity": "important",
      "category": "behavior-preservation",
      "location": "src/example.py:42",
      "claim": "The new timeout branch skips the existing retry path.",
      "failureScenario": "When the first request times out, the operation exits instead of retrying once.",
      "evidence": "The changed branch returns before call_retry().",
      "status": "unverified"
    }
  ]
}
